{"$schema":"https://json-schema.org/draft/2020-12/schema","$id":"https://github.com/safal207/robys-coffee-house-demo/qa/virtual-review-panel.schema.json","title":"Robis Virtual Review Panel v1","type":"object","additionalProperties":false,"required":["schema_version","subject","activation","implementation","authority","roles","root_causes","dissent","decision","transition","time","evidence","causal_basis","supersession","record_id"],"properties":{"schema_version":{"const":"robis.virtual-review-panel.v1"},"subject":{"type":"object","additionalProperties":false,"required":["repository","pull_request","head_sha"],"properties":{"repository":{"type":"string","pattern":"^[^/]+/[^/]+$"},"pull_request":{"type":"integer","minimum":1},"head_sha":{"type":"string","pattern":"^[0-9a-f]{40}$"}}},"activation":{"type":"object","additionalProperties":false,"required":["reason_code","external_provider","external_lane_satisfied","provider_evidence_ref"],"properties":{"reason_code":{"enum":["QUOTA_EXHAUSTED","PROVIDER_UNAVAILABLE","NO_ACK","MANUAL_ADVISORY_REQUEST"]},"external_provider":{"const":"CodeRabbit"},"external_lane_satisfied":{"const":false},"provider_evidence_ref":{"type":"string","minLength":1}}},"implementation":{"type":"object","additionalProperties":false,"required":["mode","disclosed","external_provider_substitute","providers"],"properties":{"mode":{"enum":["single_model_role_simulation","multi_provider"]},"disclosed":{"const":true},"external_provider_substitute":{"const":false},"providers":{"type":"array","minItems":1,"items":{"type":"object","additionalProperties":false,"required":["id","label","evidence_ref"],"properties":{"id":{"type":"string","minLength":1},"label":{"type":"string","minLength":1},"evidence_ref":{"type":"string","minLength":1}}}}}},"authority":{"type":"object","additionalProperties":false,"required":["role","can_execute","can_approve","can_merge","human_adjudication_required"],"properties":{"role":{"const":"advisory_panel"},"can_execute":{"const":false},"can_approve":{"const":false},"can_merge":{"const":false},"human_adjudication_required":{"const":true}}},"roles":{"type":"array","minItems":5,"maxItems":5,"items":{"$ref":"#/$defs/role"}},"root_causes":{"type":"array","items":{"$ref":"#/$defs/rootCause"}},"dissent":{"type":"array","items":{"$ref":"#/$defs/dissent"}},"decision":{"type":"object","additionalProperties":false,"required":["id","verdict","advisory_only"],"properties":{"id":{"type":"string","minLength":1},"verdict":{"enum":["BLOCK","FIX_THEN_RERUN","WAIT_FOR_EVIDENCE","READY_WITH_ADVISORY_GAPS"]},"advisory_only":{"const":true}}},"transition":{"type":"object","additionalProperties":false,"required":["state_from","state_to","tension","cause_id","parent_cause_id","smallest_justified_action"],"properties":{"state_from":{"const":"EXTERNAL_REVIEW_STALLED"},"state_to":{"enum":["BLOCKED","FIX_REQUIRED","EVIDENCE_PENDING","READY_ADVISORY"]},"tension":{"type":"string","minLength":1},"cause_id":{"type":"string","pattern":"^panel-cause:[0-9a-f]{64}$"},"parent_cause_id":{"type":"string","pattern":"^head:[0-9a-f]{40}$"},"smallest_justified_action":{"type":"string","minLength":1}}},"time":{"type":"object","additionalProperties":false,"required":["valid_time","transaction_time","valid_time_source"],"properties":{"valid_time":{"type":"string","format":"date-time"},"transaction_time":{"type":"string","format":"date-time"},"valid_time_source":{"const":"github_pull_request_head_observation"}}},"evidence":{"type":"object","additionalProperties":false,"required":["head_sha","manifest"],"properties":{"head_sha":{"type":"string","pattern":"^[0-9a-f]{40}$"},"manifest":{"type":"array","minItems":1,"items":{"$ref":"#/$defs/manifest"}}}},"causal_basis":{"type":"object"},"supersession":{"type":"object","additionalProperties":false,"required":["supersedes_record","must_be_superseded_after_head_change"],"properties":{"supersedes_record":{"type":["string","null"]},"must_be_superseded_after_head_change":{"const":true}}},"record_id":{"type":"string","pattern":"^panel:[0-9a-f]{64}$"}},"$defs":{"evidenceRef":{"type":"object","additionalProperties":false,"required":["path","line","head_sha"],"properties":{"path":{"type":"string","minLength":1},"line":{"type":"integer","minimum":1},"head_sha":{"type":"string","pattern":"^[0-9a-f]{40}$"}}},"observation":{"type":"object","additionalProperties":false,"required":["id","severity","root_cause_key","title","confidence","recommendation","evidence_refs"],"properties":{"id":{"type":"string","minLength":1},"severity":{"enum":["P0","P1","P2","P3"]},"root_cause_key":{"type":"string","minLength":1},"title":{"type":"string","minLength":1},"confidence":{"type":"number","minimum":0,"maximum":1},"recommendation":{"type":"string","minLength":1},"evidence_refs":{"type":"array","minItems":1,"items":{"$ref":"#/$defs/evidenceRef"}}}},"role":{"type":"object","additionalProperties":false,"required":["id","vote","rationale","observations"],"properties":{"id":{"enum":["causal_architect","temporal_provenance","adversarial_semantics","authority_safety","ci_reliability"]},"vote":{"enum":["PASS","BLOCK","FIX_THEN_RERUN","WAIT_FOR_EVIDENCE","READY_WITH_ADVISORY_GAPS"]},"rationale":{"type":"string","minLength":1},"observations":{"type":"array","items":{"$ref":"#/$defs/observation"}}}},"rootCause":{"type":"object","additionalProperties":false,"required":["key","severity","roles","observation_ids","title"],"properties":{"key":{"type":"string","minLength":1},"severity":{"enum":["P0","P1","P2","P3"]},"roles":{"type":"array","minItems":1,"items":{"type":"string"}},"observation_ids":{"type":"array","minItems":1,"items":{"type":"string"}},"title":{"type":"string","minLength":1}}},"dissent":{"type":"object","additionalProperties":false,"required":["role_id","vote","reason"],"properties":{"role_id":{"type":"string","minLength":1},"vote":{"type":"string","minLength":1},"reason":{"type":"string","minLength":1}}},"manifest":{"type":"object","additionalProperties":false,"required":["role","byte_size","sha256","head_sha"],"properties":{"role":{"type":"string","minLength":1},"byte_size":{"type":"integer","minimum":1},"sha256":{"type":"string","pattern":"^[0-9a-f]{64}$"},"head_sha":{"type":"string","pattern":"^[0-9a-f]{40}$"}}}}}