{"schema_version":"robis.virtual-review-panel.v1","subject":{"repository":"safal207/robys-coffee-house-demo","pull_request":225,"head_sha":"9fa5ff666f1aa7eb80ae0d1061e3917358e9dedb"},"activation":{"reason_code":"QUOTA_EXHAUSTED","external_provider":"CodeRabbit","external_lane_satisfied":false,"provider_evidence_ref":"issue-comment:5030601944"},"implementation":{"mode":"single_model_role_simulation","disclosed":true,"external_provider_substitute":false,"providers":[{"id":"openai:gpt-5.6-thinking","label":"GPT-5.6 Thinking","evidence_ref":"conversation-run:virtual-panel-pr-225"}]},"authority":{"role":"advisory_panel","can_execute":false,"can_approve":false,"can_merge":false,"human_adjudication_required":true},"roles":[{"id":"causal_architect","vote":"FIX_THEN_RERUN","rationale":"The causal identity must include the exact evidence set.","observations":[{"id":"causal_architect:CR-001","severity":"P2","root_cause_key":"evidence-not-in-causal-identity","title":"Causal identity omits the evidence manifest","confidence":0.98,"recommendation":"Include a deterministic digest of the full evidence manifest in causal_basis.","evidence_refs":[{"path":"scripts/causal_review_envelope.py","line":206,"head_sha":"9fa5ff666f1aa7eb80ae0d1061e3917358e9dedb"}]}]},{"id":"temporal_provenance","vote":"FIX_THEN_RERUN","rationale":"Commit timestamps are issuer-controlled and do not prove when the PR head became observable.","observations":[{"id":"temporal_provenance:TM-001","severity":"P2","root_cause_key":"issuer-controlled-valid-time","title":"valid_time uses commit metadata instead of trusted head observation","confidence":0.97,"recommendation":"Record a GitHub-observed head timestamp and preserve commit time only as source metadata.","evidence_refs":[{"path":"scripts/causal_review_envelope.py","line":260,"head_sha":"9fa5ff666f1aa7eb80ae0d1061e3917358e9dedb"}]}]},{"id":"adversarial_semantics","vote":"FIX_THEN_RERUN","rationale":"Narrative fields can be changed and rehashed without being re-derived.","observations":[{"id":"adversarial_semantics:AD-001","severity":"P2","root_cause_key":"unsealed-decision-rationale","title":"decision.why is not derived by the semantic seal","confidence":0.96,"recommendation":"Derive or independently validate decision.why from the verdict and evidence state.","evidence_refs":[{"path":"scripts/verify_causal_review_semantics.py","line":89,"head_sha":"9fa5ff666f1aa7eb80ae0d1061e3917358e9dedb"}]}]},{"id":"authority_safety","vote":"PASS","rationale":"The panel and envelope remain advisory and cannot execute, approve, or merge.","observations":[]},{"id":"ci_reliability","vote":"WAIT_FOR_EVIDENCE","rationale":"The current provider comment is updated in place, but the upstream gate uses created_at only.","observations":[{"id":"ci_reliability:CI-001","severity":"P2","root_cause_key":"provider-comment-update-not-observed","title":"Reused provider quota comments are filtered by created_at only","confidence":0.99,"recommendation":"Use updated_at for provider evidence while keeping trusted requests bound to created_at and current-head text.","evidence_refs":[{"path":"scripts/verify-ai-review-contract.cjs","line":137,"head_sha":"9fa5ff666f1aa7eb80ae0d1061e3917358e9dedb"}]}]}],"root_causes":[{"key":"evidence-not-in-causal-identity","severity":"P2","roles":["causal_architect"],"observation_ids":["causal_architect:CR-001"],"title":"Causal identity omits the evidence manifest"},{"key":"issuer-controlled-valid-time","severity":"P2","roles":["temporal_provenance"],"observation_ids":["temporal_provenance:TM-001"],"title":"valid_time uses commit metadata instead of trusted head observation"},{"key":"provider-comment-update-not-observed","severity":"P2","roles":["ci_reliability"],"observation_ids":["ci_reliability:CI-001"],"title":"Reused provider quota comments are filtered by created_at only"},{"key":"unsealed-decision-rationale","severity":"P2","roles":["adversarial_semantics"],"observation_ids":["adversarial_semantics:AD-001"],"title":"decision.why is not derived by the semantic seal"}],"dissent":[{"role_id":"ci_reliability","vote":"WAIT_FOR_EVIDENCE","reason":"The current provider comment is updated in place, but the upstream gate uses created_at only."}],"decision":{"id":"panel-decision:9fa5ff666f1aa7eb80ae0d1061e3917358e9dedb:fix_then_rerun","verdict":"FIX_THEN_RERUN","advisory_only":true},"transition":{"state_from":"EXTERNAL_REVIEW_STALLED","state_to":"FIX_REQUIRED","tension":"External review stalled; role-separated panel found unique causes.","cause_id":"panel-cause:fcc655bd8d9c55c7008a4822dbbb0e71688960ed8938828b7d0b84593d4818e5","parent_cause_id":"head:9fa5ff666f1aa7eb80ae0d1061e3917358e9dedb","smallest_justified_action":"Fix the four unique P2 causes, create a new exact head, and rerun both the panel and external lane."},"time":{"valid_time":"2026-07-21T05:54:02Z","transaction_time":"2026-07-21T05:59:57Z","valid_time_source":"github_pull_request_head_observation"},"evidence":{"head_sha":"9fa5ff666f1aa7eb80ae0d1061e3917358e9dedb","manifest":[{"role":"causal-envelope-diff","byte_size":26,"sha256":"6a456848bb15b5dea78ea4a7bb299060b3dd8d201aeaf778d75522b50790bb4b","head_sha":"9fa5ff666f1aa7eb80ae0d1061e3917358e9dedb"},{"role":"provider-state","byte_size":37,"sha256":"a558004d490aed25b8c75df60fccb5595a2b4eb94899e34578a20a4bb18f1e87","head_sha":"9fa5ff666f1aa7eb80ae0d1061e3917358e9dedb"},{"role":"workflow-status","byte_size":26,"sha256":"77e0ab00d1d8ab07aeb0dfee9afcf461709d6cae472c7e0b96d4818bd8fff689","head_sha":"9fa5ff666f1aa7eb80ae0d1061e3917358e9dedb"}]},"causal_basis":{"subject":{"repository":"safal207/robys-coffee-house-demo","pull_request":225,"head_sha":"9fa5ff666f1aa7eb80ae0d1061e3917358e9dedb"},"activation":{"reason_code":"QUOTA_EXHAUSTED","external_provider":"CodeRabbit","external_lane_satisfied":false,"provider_evidence_ref":"issue-comment:5030601944"},"implementation":{"mode":"single_model_role_simulation","disclosed":true,"external_provider_substitute":false,"providers":[{"id":"openai:gpt-5.6-thinking","label":"GPT-5.6 Thinking","evidence_ref":"conversation-run:virtual-panel-pr-225"}]},"roles":[{"id":"causal_architect","vote":"FIX_THEN_RERUN","rationale":"The causal identity must include the exact evidence set.","observations":[{"id":"causal_architect:CR-001","severity":"P2","root_cause_key":"evidence-not-in-causal-identity","title":"Causal identity omits the evidence manifest","confidence":0.98,"recommendation":"Include a deterministic digest of the full evidence manifest in causal_basis.","evidence_refs":[{"path":"scripts/causal_review_envelope.py","line":206,"head_sha":"9fa5ff666f1aa7eb80ae0d1061e3917358e9dedb"}]}]},{"id":"temporal_provenance","vote":"FIX_THEN_RERUN","rationale":"Commit timestamps are issuer-controlled and do not prove when the PR head became observable.","observations":[{"id":"temporal_provenance:TM-001","severity":"P2","root_cause_key":"issuer-controlled-valid-time","title":"valid_time uses commit metadata instead of trusted head observation","confidence":0.97,"recommendation":"Record a GitHub-observed head timestamp and preserve commit time only as source metadata.","evidence_refs":[{"path":"scripts/causal_review_envelope.py","line":260,"head_sha":"9fa5ff666f1aa7eb80ae0d1061e3917358e9dedb"}]}]},{"id":"adversarial_semantics","vote":"FIX_THEN_RERUN","rationale":"Narrative fields can be changed and rehashed without being re-derived.","observations":[{"id":"adversarial_semantics:AD-001","severity":"P2","root_cause_key":"unsealed-decision-rationale","title":"decision.why is not derived by the semantic seal","confidence":0.96,"recommendation":"Derive or independently validate decision.why from the verdict and evidence state.","evidence_refs":[{"path":"scripts/verify_causal_review_semantics.py","line":89,"head_sha":"9fa5ff666f1aa7eb80ae0d1061e3917358e9dedb"}]}]},{"id":"authority_safety","vote":"PASS","rationale":"The panel and envelope remain advisory and cannot execute, approve, or merge.","observations":[]},{"id":"ci_reliability","vote":"WAIT_FOR_EVIDENCE","rationale":"The current provider comment is updated in place, but the upstream gate uses created_at only.","observations":[{"id":"ci_reliability:CI-001","severity":"P2","root_cause_key":"provider-comment-update-not-observed","title":"Reused provider quota comments are filtered by created_at only","confidence":0.99,"recommendation":"Use updated_at for provider evidence while keeping trusted requests bound to created_at and current-head text.","evidence_refs":[{"path":"scripts/verify-ai-review-contract.cjs","line":137,"head_sha":"9fa5ff666f1aa7eb80ae0d1061e3917358e9dedb"}]}]}],"root_causes":[{"key":"evidence-not-in-causal-identity","severity":"P2","roles":["causal_architect"],"observation_ids":["causal_architect:CR-001"],"title":"Causal identity omits the evidence manifest"},{"key":"issuer-controlled-valid-time","severity":"P2","roles":["temporal_provenance"],"observation_ids":["temporal_provenance:TM-001"],"title":"valid_time uses commit metadata instead of trusted head observation"},{"key":"provider-comment-update-not-observed","severity":"P2","roles":["ci_reliability"],"observation_ids":["ci_reliability:CI-001"],"title":"Reused provider quota comments are filtered by created_at only"},{"key":"unsealed-decision-rationale","severity":"P2","roles":["adversarial_semantics"],"observation_ids":["adversarial_semantics:AD-001"],"title":"decision.why is not derived by the semantic seal"}],"dissent":[{"role_id":"ci_reliability","vote":"WAIT_FOR_EVIDENCE","reason":"The current provider comment is updated in place, but the upstream gate uses created_at only."}],"evidence":{"head_sha":"9fa5ff666f1aa7eb80ae0d1061e3917358e9dedb","manifest":[{"role":"causal-envelope-diff","byte_size":26,"sha256":"6a456848bb15b5dea78ea4a7bb299060b3dd8d201aeaf778d75522b50790bb4b","head_sha":"9fa5ff666f1aa7eb80ae0d1061e3917358e9dedb"},{"role":"provider-state","byte_size":37,"sha256":"a558004d490aed25b8c75df60fccb5595a2b4eb94899e34578a20a4bb18f1e87","head_sha":"9fa5ff666f